,0,1,2,3,4,5,6,7,8,9,10,11,12
0,Product code,Product label,United States of America's exports to Greenland,United States of America's exports to Greenland,United States of America's exports to Greenland,Greenland's imports from world,Greenland's imports from world,Greenland's imports from world,Greenland's imports from world,United States of America's exports to world,United States of America's exports to world,United States of America's exports to world,United States of America's exports to world
1,Product code,Product label,Value in 2021,Value in 2022,Value in 2023,,Value in 2021,Value in 2022,Value in 2023,,Value in 2021,Value in 2022,Value in 2023
2,'TOTAL,All products,13134,7373,6896,,952785,1062579,1130642,,1754300368,2062937261,2019159665
3,'87,"Vehicles other than railway or tramway rolling stock, and parts and accessories thereof",979,919,2357,,38901,43460,42449,,122827854,134886249,152826672
4,'90,"Optical, photographic, cinematographic, measuring, checking, precision, medical or surgical ...",803,1315,1118,,14023,13078,16272,,91627571,99053192,105107609
5,'85,"Electrical machinery and equipment and parts thereof; sound recorders and reproducers, television ...",6334,1299,1060,,51194,47640,58087,,185778022,197748997,200654689
6,'84,"Nuclear reactors, boilers, machinery and mechanical appliances; parts thereof",1505,535,598,,110928,114455,115168,,209410339,229594065,233009959
7,'99,Commodities not elsewhere specified,795,450,502,,15381,16129,21280,,49130835,62957556,67359995
8,'88,"Aircraft, spacecraft, and parts thereof",410,1748,427,,20560,104398,20225,,89518426,102849540,124909470
9,'63,Other made-up textile articles; sets; worn clothing and worn textile articles; rags,13,44,147,,4668,4844,5039,,2892580,2939810,2618858
10,'82,"Tools, implements, cutlery, spoons and forks, of base metal; parts thereof of base metal",56,114,106,,9405,10414,13044,,4759263,5077957,4963181
11,'40,Rubber and articles thereof,73,137,93,,5301,4537,5984,,13153623,14656598,14646521
12,'02,Meat and edible meat offal,0,0,73,,21729,23501,23605,,22124262,23344302,21807421
13,'39,Plastics and articles thereof,61,31,68,,20320,19086,20709,,74313449,83283461,77796411
14,'30,Pharmaceutical products,0,0,44,,7424,8167,3653,,77849066,83492755,90308213
15,'93,Arms and ammunition; parts and accessories thereof,446,411,43,,2789,1906,2093,,4245180,4877955,5770286
16,'27,"Mineral fuels, mineral oils and products of their distillation; bituminous substances; mineral ...",31,39,36,,137253,259772,254418,,240348491,378564312,323170542
17,'73,Articles of iron or steel,6,20,31,,44868,54814,54832,,19291439,22006888,22722824
18,'32,"Tanning or dyeing extracts; tannins and their derivatives; dyes, pigments and other colouring ...",0,0,22,,5404,5010,5564,,7967676,8643291,7977328
19,'44,Wood and articles of wood; wood charcoal,0,0,20,,19567,16093,18603,,9743086,10439488,9505752
20,'54,Man-made filaments; strip and the like of man-made textile materials,0,0,16,,214,162,112,,1469319,1633167,1532639
21,'96,Miscellaneous manufactured articles,7,10,13,,3586,2854,3436,,2336068,2661046,2643892
22,'62,"Articles of apparel and clothing accessories, not knitted or crocheted",6,0,12,,12232,15164,14214,,2163568,2646804,2839139
23,'71,"Natural or cultured pearls, precious or semi-precious stones, precious metals, metals clad ...",0,3,12,,1624,1641,869,,82367398,92470876,76672348
24,'89,"Ships, boats and floating structures",80,87,11,,122089,11976,105465,,2310974,2615501,3167933
25,'95,"Toys, games and sports requisites; parts and accessories thereof",8,77,11,,6589,6411,7722,,6789420,7386133,7603164
26,'97,"Works of art, collectors' pieces and antiques",3,0,10,,252,125,218,,8679821,11022556,11126131
27,'92,Musical instruments; parts and accessories of such articles,8,0,9,,324,280,237,,851690,935608,928733
28,'38,Miscellaneous chemical products,18,23,9,,4259,7601,10485,,36893596,41189143,38635587
29,'33,"Essential oils and resinoids; perfumery, cosmetic or toilet preparations",0,0,8,,4859,4242,4368,,13578568,14249645,14951439
30,'83,Miscellaneous articles of base metal,26,7,7,,1993,1555,2272,,4983597,5697372,5840037
31,'42,"Articles of leather; saddlery and harness; travel goods, handbags and similar containers; articles ...",17,9,6,,2529,1310,1257,,1434670,1608212,1638216
32,'19,"Preparations of cereals, flour, starch or milk; pastrycooks' products",0,0,5,,18912,20158,22116,,4356778,4869079,5162951
33,'10,Cereals,0,0,4,,752,904,1075,,30352567,31578972,23343580
34,'34,"Soap, organic surface-active agents, washing preparations, lubricating preparations, artificial ...",0,0,3,,7335,5739,6390,,7686222,8440859,8004948
35,'07,Edible vegetables and certain roots and tubers,0,0,3,,5635,5459,6272,,4927469,5041199,5335168
36,'16,"Preparations of meat, of fish, of crustaceans, molluscs or other aquatic invertebrates, or ...",0,0,3,,14468,15452,16981,,2341858,2564607,2400752
37,'59,"Impregnated, coated, covered or laminated textile fabrics; textile articles of a kind suitable ...",0,3,3,,933,633,1272,,2089033,2235287,2037867
38,'49,"Printed books, newspapers, pictures and other products of the printing industry; manuscripts, ...",0,0,3,,1790,1567,2505,,4209947,4245569,4079717
39,'64,"Footwear, gaiters and the like; parts of such articles",0,0,3,,6339,5467,4151,,1150007,1343430,1414362
40,'65,Headgear and parts thereof,0,8,0,,433,377,579,,363053,520352,519846
41,'66,"Umbrellas, sun umbrellas, walking sticks, seat-sticks, whips, riding-crops and parts thereof",0,0,0,,20,26,64,,44899,57514,52977
42,'67,Prepared feathers and down and articles made of feathers or of down; artificial flowers; articles ...,0,0,0,,140,40,54,,131555,159929,143078
43,'68,"Articles of stone, plaster, cement, asbestos, mica or similar materials",0,0,0,,13338,7004,9483,,3853827,4288233,4354265
44,'69,Ceramic products,0,0,0,,1934,3197,3370,,2291792,2488620,2329982
45,'70,Glass and glassware,6,9,0,,3956,6169,4912,,5651743,6093142,6154191
46,'74,Copper and articles thereof,11,0,0,,794,1046,2213,,10394755,10050035,10949330
47,'75,Nickel and articles thereof,0,0,0,,50,35,12,,2204622,3142630,4071617
48,'76,Aluminium and articles thereof,3,0,0,,6648,7003,7523,,12033895,14511112,14277975
49,'78,Lead and articles thereof,0,0,0,,83,68,106,,270871,192932,235419
50,'79,Zinc and articles thereof,0,0,0,,68,93,103,,408976,542242,383422
51,'80,Tin and articles thereof,0,0,0,,5,1,5,,238451,261297,244797
52,'81,Other base metals; cermets; articles thereof,0,0,0,,415,173,26,,2374517,2948134,3281494
53,'50,Silk,0,0,0,,22,12,14,,5538,5445,6626
54,'51,"Wool, fine or coarse animal hair; horsehair yarn and woven fabric",4,0,0,,294,321,467,,61276,62325,62071
55,'52,Cotton,0,0,0,,89,103,95,,7129541,10744033,7296980
56,'53,Other vegetable textile fibres; paper yarn and woven fabrics of paper yarn,0,0,0,,216,11,7,,21699,23910,23615
57,'45,Cork and articles of cork,0,0,0,,5,15,16,,21103,26438,26842
58,'46,"Manufactures of straw, of esparto or of other plaiting materials; basketware and wickerwork",0,0,0,,68,69,60,,27025,21764,31278
59,'47,Pulp of wood or of other fibrous cellulosic material; recovered (waste and scrap) paper or ...,0,0,0,,28,74,119,,9575720,10850826,8769626
60,'48,"Paper and paperboard; articles of paper pulp, of paper or of paperboard",7,0,0,,9178,11305,17400,,15357618,16984547,14967434
61,'60,Knitted or crocheted fabrics,0,0,0,,373,178,366,,821834,905325,751910
62,'61,"Articles of apparel and clothing accessories, knitted or crocheted",57,57,0,,11895,11229,11502,,3030769,3492789,3394027
63,'43,Furskins and artificial fur; manufactures thereof,0,0,0,,257,906,294,,142967,122462,101152
64,'55,Man-made staple fibres,0,0,0,,36,44,46,,2092227,2320179,2210887
65,'56,"Wadding, felt and nonwovens; special yarns; twine, cordage, ropes and cables and articles thereof",0,0,0,,3740,4881,4765,,2605897,2611644,2542395
66,'57,Carpets and other textile floor coverings,0,0,0,,332,287,286,,776609,777073,753219
67,'58,Special woven fabrics; tufted textile fabrics; lace; tapestries; trimmings; embroidery,0,0,0,,57,108,102,,403747,414943,428342
68,'17,Sugars and sugar confectionery,0,0,0,,5338,5576,6171,,2068251,2439096,2729350
69,'18,Cocoa and cocoa preparations,0,0,0,,5087,4983,5534,,1979976,2024138,2098865
70,'08,Edible fruit and nuts; peel of citrus fruit or melons,0,0,0,,8095,6716,7616,,15061750,14756429,14865303
71,'09,"Coffee, tea, maté and spices",0,0,0,,5230,4258,4701,,1096175,1489801,1481480
72,'28,"Inorganic chemicals; organic or inorganic compounds of precious metals, of rare-earth metals, ...",0,0,0,,2445,2922,3908,,13499059,16837864,15010743
73,'29,Organic chemicals,52,0,0,,680,869,806,,43083944,51063345,51730963
74,'31,Fertilisers,0,0,0,,2205,5097,6424,,4621063,8472033,5483859
75,'35,Albuminoidal substances; modified starches; glues; enzymes,7,0,0,,280,226,306,,4685907,5203359,5315815
76,'36,Explosives; pyrotechnic products; matches; pyrophoric alloys; certain combustible preparations,0,0,0,,2055,1763,1069,,656457,750935,878798
77,'37,Photographic or cinematographic goods,0,0,0,,103,110,98,,2293364,2195023,2127650
78,'01,Live animals,0,0,0,,,1,,,1279591,1198281,1191003
79,'41,Raw hides and skins (other than furskins) and leather,0,0,0,,14,20,17,,1863084,1762333,1550763
80,'11,Products of the milling industry; malt; starches; inulin; wheat gluten,0,0,0,,1713,1744,1949,,1045682,1150195,1197838
81,'12,"Oil seeds and oleaginous fruits; miscellaneous grains, seeds and fruit; industrial or medicinal ...",0,0,0,,415,318,281,,33042608,40194577,33904016
82,'13,"Lac; gums, resins and other vegetable saps and extracts",0,0,0,,61,29,65,,634679,693972,603222
83,'14,Vegetable plaiting materials; vegetable products not elsewhere specified or included,0,0,0,,11,11,7,,32506,31254,25974
84,'15,"Animal, vegetable or microbial fats and oils and their cleavage products; prepared edible fats; ...",0,0,0,,1526,1555,1561,,4279475,4340585,2748547
85,'03,"Fish and crustaceans, molluscs and other aquatic invertebrates",177,0,0,,13450,12636,18942,,4854294,5077262,4709611
86,'04,"Dairy produce; birds' eggs; natural honey; edible products of animal origin, not elsewhere ...",0,0,0,,14954,15153,17143,,6483005,7910015,6661220
87,'05,"Products of animal origin, not elsewhere specified or included",0,0,0,,108,44,9,,1241815,1346056,1396492
88,'06,"Live trees and other plants; bulbs, roots and the like; cut flowers and ornamental foliage",49,12,0,,646,448,473,,520814,535762,489733
89,'20,"Preparations of vegetables, fruit, nuts or other parts of plants",0,0,0,,9560,10252,11474,,5005347,5385444,5442010
90,'21,Miscellaneous edible preparations,0,0,0,,15431,14314,15965,,10487862,10459069,10272263
91,'22,"Beverages, spirits and vinegar",0,0,0,,18381,18084,18326,,8460677,10139208,9930612
92,'23,Residues and waste from the food industries; prepared animal fodder,0,0,0,,1968,2290,2434,,13119396,14756163,15822093
93,'24,"Tobacco and manufactured tobacco substitutes; products, whether or not containing nicotine, ...",8,0,0,,8446,9813,11055,,1166032,1229489,1422932
94,'25,"Salt; sulphur; earths and stone; plastering materials, lime and cement",0,0,0,,878,426,720,,2832298,3301294,3161213
95,'26,"Ores, slag and ash",0,0,0,,8,8,15,,8488980,8565365,8103305
96,'86,"Railway or tramway locomotives, rolling stock and parts thereof; railway or tramway track fixtures ...",4,0,0,,935,872,2362,,2653173,3522489,3615147
97,'72,Iron and steel,0,0,0,,8212,9278,6588,,18675764,20891807,20463485
98,'94,"Furniture; bedding, mattresses, mattress supports, cushions and similar stuffed furnishings; ...",1042,7,0,,23373,21767,28049,,9277421,10087139,10055768
99,'91,Clocks and watches and parts thereof,21,0,0,,259,191,124,,1519662,1656127,1790459
