,0,1,2,3,4,5,6,7,8,9,10,11,12
0,Product code,Product label,United States of America's exports to Switzerland,United States of America's exports to Switzerland,United States of America's exports to Switzerland,Switzerland's imports from world,Switzerland's imports from world,Switzerland's imports from world,Switzerland's imports from world,United States of America's exports to world,United States of America's exports to world,United States of America's exports to world,United States of America's exports to world
1,Product code,Product label,Value in 2021,Value in 2022,Value in 2023,,Value in 2021,Value in 2022,Value in 2023,,Value in 2021,Value in 2022,Value in 2023
2,'TOTAL,All products,23683408,36972876,27956452,,324497583,356763182,366266257,,1754300368,2062937261,2019159665
3,'71,"Natural or cultured pearls, precious or semi-precious stones, precious metals, metals clad ...",13454253,24633578,14503214,,110964234,117650326,122676119,,82367398,92470876,76672348
4,'30,Pharmaceutical products,1959563,2718395,2768806,,42263869,48719814,58512384,,77849066,83492755,90308213
5,'97,"Works of art, collectors' pieces and antiques",1161418,1822562,1832555,,1916283,1933739,2206446,,8679821,11022556,11126131
6,'90,"Optical, photographic, cinematographic, measuring, checking, precision, medical or surgical ...",1188944,1296556,1410400,,9084765,9259464,9807319,,91627571,99053192,105107609
7,'29,Organic chemicals,628340,731073,1387872,,7955694,9206418,8969813,,43083944,51063345,51730963
8,'88,"Aircraft, spacecraft, and parts thereof",741298,859185,1336994,,2147976,1861191,2218700,,89518426,102849540,124909470
9,'99,Commodities not elsewhere specified,605801,841251,742201,,,,,,49130835,62957556,67359995
10,'84,"Nuclear reactors, boilers, machinery and mechanical appliances; parts thereof",530690,607161,638834,,21108032,21858153,22749846,,209410339,229594065,233009959
11,'85,"Electrical machinery and equipment and parts thereof; sound recorders and reproducers, television ...",506646,618831,635954,,17141962,18523090,18640239,,185778022,197748997,200654689
12,'91,Clocks and watches and parts thereof,297965,325872,365756,,3586153,3741133,3934579,,1519662,1656127,1790459
13,'27,"Mineral fuels, mineral oils and products of their distillation; bituminous substances; mineral ...",751535,549469,348211,,10898460,23578288,14366935,,240348491,378564312,323170542
14,'33,"Essential oils and resinoids; perfumery, cosmetic or toilet preparations",323133,404114,275246,,1699185,1751373,1882812,,13578568,14249645,14951439
15,'39,Plastics and articles thereof,189931,193095,187735,,8157568,8390760,7714773,,74313449,83283461,77796411
16,'35,Albuminoidal substances; modified starches; glues; enzymes,155888,123685,153841,,441732,437705,533479,,4685907,5203359,5315815
17,'87,"Vehicles other than railway or tramway rolling stock, and parts and accessories thereof",166917,112613,144096,,15986827,16739474,20545097,,122827854,134886249,152826672
18,'32,"Tanning or dyeing extracts; tannins and their derivatives; dyes, pigments and other colouring ...",108925,131370,130898,,1175486,1111313,1026977,,7967676,8643291,7977328
19,'38,Miscellaneous chemical products,110907,130588,121250,,2410485,2369711,2233062,,36893596,41189143,38635587
20,'28,"Inorganic chemicals; organic or inorganic compounds of precious metals, of rare-earth metals, ...",27408,51785,88636,,739975,926559,920834,,13499059,16837864,15010743
21,'47,Pulp of wood or of other fibrous cellulosic material; recovered (waste and scrap) paper or ...,26902,48023,56858,,138729,157021,106523,,9575720,10850826,8769626
22,'81,Other base metals; cermets; articles thereof,34454,42735,56804,,191611,251970,254344,,2374517,2948134,3281494
23,'69,Ceramic products,50448,12991,56747,,763447,747756,699586,,2291792,2488620,2329982
24,'75,Nickel and articles thereof,29071,47424,49335,,128378,184664,237757,,2204622,3142630,4071617
25,'49,"Printed books, newspapers, pictures and other products of the printing industry; manuscripts, ...",20874,23808,48389,,1322523,1256613,1237339,,4209947,4245569,4079717
26,'73,Articles of iron or steel,37032,46793,47770,,4519839,4799064,4600032,,19291439,22006888,22722824
27,'93,Arms and ammunition; parts and accessories thereof,11839,14128,41667,,216219,219318,303451,,4245180,4877955,5770286
28,'72,Iron and steel,32450,31433,38039,,3381422,3954974,2887995,,18675764,20891807,20463485
29,'70,Glass and glassware,18277,24205,32367,,1124776,1151287,1117176,,5651743,6093142,6154191
30,'64,"Footwear, gaiters and the like; parts of such articles",5525,4967,29898,,2329446,2328067,2379224,,1150007,1343430,1414362
31,'42,"Articles of leather; saddlery and harness; travel goods, handbags and similar containers; articles ...",12100,20693,24127,,1346715,1398947,1457797,,1434670,1608212,1638216
32,'24,"Tobacco and manufactured tobacco substitutes; products, whether or not containing nicotine, ...",126477,104608,22632,,287350,329509,387971,,1166032,1229489,1422932
33,'26,"Ores, slag and ash",92,99,21610,,10519,12169,15002,,8488980,8565365,8103305
34,'22,"Beverages, spirits and vinegar",30850,31904,17682,,2505240,2474383,2548029,,8460677,10139208,9930612
35,'74,Copper and articles thereof,14765,18665,16975,,1192410,1284726,1156417,,10394755,10050035,10949330
36,'95,"Toys, games and sports requisites; parts and accessories thereof",22199,20471,16535,,1522075,1391785,1384718,,6789420,7386133,7603164
37,'82,"Tools, implements, cutlery, spoons and forks, of base metal; parts thereof of base metal",15506,14273,16155,,1177081,1086273,1138827,,4759263,5077957,4963181
38,'94,"Furniture; bedding, mattresses, mattress supports, cushions and similar stuffed furnishings; ...",16024,16145,15871,,5323739,5195470,5176440,,9277421,10087139,10055768
39,'55,Man-made staple fibres,1226,7310,15751,,85583,86945,87387,,2092227,2320179,2210887
40,'56,"Wadding, felt and nonwovens; special yarns; twine, cordage, ropes and cables and articles thereof",12324,12775,14690,,302951,300484,297658,,2605897,2611644,2542395
41,'40,Rubber and articles thereof,15565,15697,14474,,1687372,1705175,1643712,,13153623,14656598,14646521
42,'48,"Paper and paperboard; articles of paper pulp, of paper or of paperboard",18758,14801,14344,,2301476,2634177,2473610,,15357618,16984547,14967434
43,'76,Aluminium and articles thereof,12201,14993,13433,,3486696,4240268,3686429,,12033895,14511112,14277975
44,'89,"Ships, boats and floating structures",5920,12179,12214,,497456,254329,345112,,2310974,2615501,3167933
45,'59,"Impregnated, coated, covered or laminated textile fabrics; textile articles of a kind suitable ...",1497,2080,11981,,181234,187228,183397,,2089033,2235287,2037867
46,'83,Miscellaneous articles of base metal,12316,12685,11429,,851948,869305,878097,,4983597,5697372,5840037
47,'02,Meat and edible meat offal,8242,11028,11379,,749633,762110,719653,,22124262,23344302,21807421
48,'08,Edible fruit and nuts; peel of citrus fruit or melons,19823,14948,10198,,1527626,1434303,1561256,,15061750,14756429,14865303
49,'68,"Articles of stone, plaster, cement, asbestos, mica or similar materials",6475,8990,10073,,1036552,1017926,1029161,,3853827,4288233,4354265
50,'34,"Soap, organic surface-active agents, washing preparations, lubricating preparations, artificial ...",9169,11184,10041,,790958,795005,827551,,7686222,8440859,8004948
51,'15,"Animal, vegetable or microbial fats and oils and their cleavage products; prepared edible fats; ...",19146,24841,9680,,449613,524394,507516,,4279475,4340585,2748547
52,'19,"Preparations of cereals, flour, starch or milk; pastrycooks' products",17773,16800,8719,,1042470,1043822,1198954,,4356778,4869079,5162951
53,'61,"Articles of apparel and clothing accessories, knitted or crocheted",6653,8497,8326,,3870023,3844783,3817740,,3030769,3492789,3394027
54,'21,Miscellaneous edible preparations,13584,13576,7747,,1024138,1005491,1089711,,10487862,10459069,10272263
55,'04,"Dairy produce; birds' eggs; natural honey; edible products of animal origin, not elsewhere ...",699,1160,6918,,764433,799862,891729,,6483005,7910015,6661220
56,'96,Miscellaneous manufactured articles,5874,14356,6726,,596395,595615,630343,,2336068,2661046,2643892
57,'63,Other made-up textile articles; sets; worn clothing and worn textile articles; rags,15135,7368,6411,,990939,884942,843322,,2892580,2939810,2618858
58,'62,"Articles of apparel and clothing accessories, not knitted or crocheted",5002,5390,5534,,4423427,4317085,4560759,,2163568,2646804,2839139
59,'52,Cotton,2385,5893,4991,,115859,139155,119922,,7129541,10744033,7296980
60,'36,Explosives; pyrotechnic products; matches; pyrophoric alloys; certain combustible preparations,803,2494,4967,,51235,58727,60629,,656457,750935,878798
61,'92,Musical instruments; parts and accessories of such articles,5883,5620,4627,,125658,118037,118788,,851690,935608,928733
62,'03,"Fish and crustaceans, molluscs and other aquatic invertebrates",4672,8894,4342,,662530,685061,692795,,4854294,5077262,4709611
63,'01,Live animals,209,409,3908,,123029,130034,154718,,1279591,1198281,1191003
64,'12,"Oil seeds and oleaginous fruits; miscellaneous grains, seeds and fruit; industrial or medicinal ...",6223,2558,3457,,390049,402801,382585,,33042608,40194577,33904016
65,'86,"Railway or tramway locomotives, rolling stock and parts thereof; railway or tramway track fixtures ...",1334,2962,3040,,893528,821106,802065,,2653173,3522489,3615147
66,'07,Edible vegetables and certain roots and tubers,5077,3045,2949,,838044,795005,879183,,4927469,5041199,5335168
67,'25,"Salt; sulphur; earths and stone; plastering materials, lime and cement",2152,2239,2932,,403801,381783,407753,,2832298,3301294,3161213
68,'05,"Products of animal origin, not elsewhere specified or included",1479,2167,2531,,97153,95381,105070,,1241815,1346056,1396492
69,'44,Wood and articles of wood; wood charcoal,3135,3128,2277,,2426195,2447063,2246961,,9743086,10439488,9505752
70,'23,Residues and waste from the food industries; prepared animal fodder,3440,1818,2018,,672677,769480,756285,,13119396,14756163,15822093
71,'41,Raw hides and skins (other than furskins) and leather,1067,1893,1977,,49381,46268,43748,,1863084,1762333,1550763
72,'09,"Coffee, tea, maté and spices",970,499,1967,,1121229,1422494,1372757,,1096175,1489801,1481480
73,'17,Sugars and sugar confectionery,2430,2970,1950,,283051,316550,375709,,2068251,2439096,2729350
74,'20,"Preparations of vegetables, fruit, nuts or other parts of plants",3951,2973,1801,,651274,644493,692750,,5005347,5385444,5442010
75,'18,Cocoa and cocoa preparations,155,570,1743,,712360,661406,741885,,1979976,2024138,2098865
76,'37,Photographic or cinematographic goods,892,2341,1720,,59320,60006,61150,,2293364,2195023,2127650
77,'54,Man-made filaments; strip and the like of man-made textile materials,1015,1285,1689,,148678,155825,145876,,1469319,1633167,1532639
78,'53,Other vegetable textile fibres; paper yarn and woven fabrics of paper yarn,2064,1114,1624,,17616,15565,17510,,21699,23910,23615
79,'57,Carpets and other textile floor coverings,1272,2020,1443,,226357,203802,209008,,776609,777073,753219
80,'65,Headgear and parts thereof,816,625,1299,,208306,223618,209654,,363053,520352,519846
81,'13,"Lac; gums, resins and other vegetable saps and extracts",4475,2826,1194,,102572,99755,100732,,634679,693972,603222
82,'10,Cereals,859,1390,1133,,353250,516705,383017,,30352567,31578972,23343580
83,'67,Prepared feathers and down and articles made of feathers or of down; artificial flowers; articles ...,635,675,564,,38597,41656,40408,,131555,159929,143078
84,'80,Tin and articles thereof,161,371,388,,8210,10059,6799,,238451,261297,244797
85,'51,"Wool, fine or coarse animal hair; horsehair yarn and woven fabric",424,467,350,,55534,61364,66317,,61276,62325,62071
86,'58,Special woven fabrics; tufted textile fabrics; lace; tapestries; trimmings; embroidery,247,554,347,,65509,65702,63466,,403747,414943,428342
87,'31,Fertilisers,664,2615,299,,173468,241679,173679,,4621063,8472033,5483859
88,'11,Products of the milling industry; malt; starches; inulin; wheat gluten,256,435,287,,105160,121476,142656,,1045682,1150195,1197838
89,'16,"Preparations of meat, of fish, of crustaceans, molluscs or other aquatic invertebrates, or ...",232,29,130,,439853,429880,440568,,2341858,2564607,2400752
90,'60,Knitted or crocheted fabrics,592,242,113,,68485,65850,56835,,821834,905325,751910
91,'78,Lead and articles thereof,67,7,111,,17951,16058,12503,,270871,192932,235419
92,'14,Vegetable plaiting materials; vegetable products not elsewhere specified or included,249,38,90,,6103,6658,5932,,32506,31254,25974
93,'45,Cork and articles of cork,62,263,67,,30677,29335,26705,,21103,26438,26842
94,'43,Furskins and artificial fur; manufactures thereof,103,16,34,,30898,31406,32386,,142967,122462,101152
95,'46,"Manufactures of straw, of esparto or of other plaiting materials; basketware and wickerwork",27,8,29,,33409,36517,30571,,27025,21764,31278
96,'50,Silk,65,51,18,,5974,7127,6951,,5538,5445,6626
97,'06,"Live trees and other plants; bulbs, roots and the like; cut flowers and ornamental foliage",1016,105,10,,730756,656874,663871,,520814,535762,489733
98,'66,"Umbrellas, sun umbrellas, walking sticks, seat-sticks, whips, riding-crops and parts thereof",18,34,3,,58375,65321,50287,,44899,57514,52977
99,'79,Zinc and articles thereof,9,27,0,,74340,80345,64636,,408976,542242,383422
